{
  "schema": 1,
  "name": "irix",
  "format": "ecoff",
  "description": "IRIX ECOFF objects: BFD ecoff-bigmips target vector.",
  "byte_order": "big",
  "target_vector": "ecoff-bigmips",
  "arch": "mips",
  "magic": "0160",
  "flags": [
    "host"
  ],
  "source": [
    {
      "file": "bfd/coff-mips.c",
      "note": "MIPS ECOFF target vector and howto table"
    },
    {
      "file": "bfd/ecoff.c",
      "note": "ECOFF backend"
    },
    {
      "file": "include/coff/mips.h",
      "note": "ECOFF container layouts and MIPS_R_* types"
    },
    {
      "file": "include/coff/external.h",
      "note": "ECOFF file and section headers"
    }
  ],
  "records": [
    {
      "name": "filehdr",
      "desc": "ECOFF file header",
      "size": 20,
      "fields": [
        {
          "name": "f_magic",
          "offset": 0,
          "size": 2
        },
        {
          "name": "f_nscns",
          "offset": 2,
          "size": 2
        },
        {
          "name": "f_timdat",
          "offset": 4,
          "size": 4
        },
        {
          "name": "f_symptr",
          "offset": 8,
          "size": 4
        },
        {
          "name": "f_nsyms",
          "offset": 12,
          "size": 4
        },
        {
          "name": "f_opthdr",
          "offset": 16,
          "size": 2
        },
        {
          "name": "f_flags",
          "offset": 18,
          "size": 2
        }
      ]
    },
    {
      "name": "aouthdr",
      "desc": "ECOFF optional header",
      "size": 56,
      "fields": [
        {
          "name": "magic",
          "offset": 0,
          "size": 2
        },
        {
          "name": "vstamp",
          "offset": 2,
          "size": 2
        },
        {
          "name": "tsize",
          "offset": 4,
          "size": 4
        },
        {
          "name": "dsize",
          "offset": 8,
          "size": 4
        },
        {
          "name": "bsize",
          "offset": 12,
          "size": 4
        },
        {
          "name": "entry",
          "offset": 16,
          "size": 4
        },
        {
          "name": "text_start",
          "offset": 20,
          "size": 4
        },
        {
          "name": "data_start",
          "offset": 24,
          "size": 4
        },
        {
          "name": "bss_start",
          "offset": 28,
          "size": 4
        },
        {
          "name": "gprmask",
          "offset": 32,
          "size": 4
        },
        {
          "name": "cprmask",
          "offset": 36,
          "size": 16
        },
        {
          "name": "gp_value",
          "offset": 52,
          "size": 4
        }
      ]
    },
    {
      "name": "reloc",
      "desc": "ECOFF relocation entry (8 bytes: address plus packed bits)",
      "size": 8,
      "fields": [
        {
          "name": "r_vaddr",
          "offset": 0,
          "size": 4
        },
        {
          "name": "r_bits",
          "offset": 4,
          "size": 4
        }
      ]
    }
  ],
  "constants": [
    {
      "name": "magic_numbers",
      "desc": "ECOFF file magic numbers",
      "items": [
        {
          "name": "MIPS_MAGIC_1",
          "value": 384
        },
        {
          "name": "MIPS_MAGIC_BIG",
          "value": 352
        },
        {
          "name": "MIPS_MAGIC_BIG2",
          "value": 355
        },
        {
          "name": "MIPS_MAGIC_BIG3",
          "value": 320,
          "desc": "Alpha magic numbers used in filehdr."
        },
        {
          "name": "MIPS_MAGIC_LITTLE",
          "value": 354
        },
        {
          "name": "MIPS_MAGIC_LITTLE2",
          "value": 358
        },
        {
          "name": "MIPS_MAGIC_LITTLE3",
          "value": 322
        }
      ]
    },
    {
      "name": "reloc_types",
      "desc": "MIPS ECOFF relocation types",
      "items": [
        {
          "name": "MIPS_R_GPREL",
          "value": 6
        },
        {
          "name": "MIPS_R_IGNORE",
          "value": 0
        },
        {
          "name": "MIPS_R_JMPADDR",
          "value": 3
        },
        {
          "name": "MIPS_R_LITERAL",
          "value": 7
        },
        {
          "name": "MIPS_R_PCREL16",
          "value": 12,
          "desc": "********************* STABS *********************"
        },
        {
          "name": "MIPS_R_REFHALF",
          "value": 1
        },
        {
          "name": "MIPS_R_REFHI",
          "value": 4
        },
        {
          "name": "MIPS_R_REFLO",
          "value": 5
        },
        {
          "name": "MIPS_R_REFWORD",
          "value": 2
        }
      ]
    }
  ],
  "relocations": [
    {
      "name": "IGNORE",
      "number": 0,
      "size": 1,
      "bitsize": 8,
      "pcrel": false,
      "overflow": "dont"
    },
    {
      "name": "REFHALF",
      "number": 1,
      "size": 2,
      "bitsize": 16,
      "pcrel": false,
      "overflow": "bitfield",
      "partial": true,
      "src_mask": 65535,
      "dst_mask": 65535
    },
    {
      "name": "REFWORD",
      "number": 2,
      "size": 4,
      "bitsize": 32,
      "pcrel": false,
      "overflow": "bitfield",
      "partial": true,
      "src_mask": 4294967295,
      "dst_mask": 4294967295
    },
    {
      "name": "JMPADDR",
      "number": 3,
      "size": 4,
      "bitsize": 26,
      "pcrel": false,
      "overflow": "dont",
      "partial": true,
      "rightshift": 2,
      "src_mask": 67108863,
      "dst_mask": 67108863
    },
    {
      "name": "REFHI",
      "number": 4,
      "size": 4,
      "bitsize": 16,
      "pcrel": false,
      "overflow": "bitfield",
      "partial": true,
      "rightshift": 16,
      "src_mask": 65535,
      "dst_mask": 65535
    },
    {
      "name": "REFLO",
      "number": 5,
      "size": 4,
      "bitsize": 16,
      "pcrel": false,
      "overflow": "dont",
      "partial": true,
      "src_mask": 65535,
      "dst_mask": 65535
    },
    {
      "name": "GPREL",
      "number": 6,
      "size": 4,
      "bitsize": 16,
      "pcrel": false,
      "overflow": "signed",
      "partial": true,
      "src_mask": 65535,
      "dst_mask": 65535
    },
    {
      "name": "LITERAL",
      "number": 7,
      "size": 4,
      "bitsize": 16,
      "pcrel": false,
      "overflow": "signed",
      "partial": true,
      "src_mask": 65535,
      "dst_mask": 65535
    },
    {
      "name": "PCREL16",
      "number": 12,
      "size": 4,
      "bitsize": 16,
      "pcrel": true,
      "overflow": "signed",
      "partial": true,
      "rightshift": 2,
      "pcrel_offset": true,
      "src_mask": 65535,
      "dst_mask": 65535
    }
  ],
  "sections": [
    {
      "name": ".text",
      "desc": "executable code"
    },
    {
      "name": ".data",
      "desc": "initialised data"
    },
    {
      "name": ".bss",
      "desc": "uninitialised data"
    },
    {
      "name": ".mdebug",
      "desc": "MIPS ECOFF debug information"
    }
  ]
}
